Questionario	Posizione	Frase	Dialetto	Comune,Provincia,Regione	Microarea,_Area,_Macroarea	Marche
		E ssi puri Giorgiu jessi, stessim' apposta	Ariano Irpino	Ariano Irpino,Avellino,Campania	Irpino	
		Si jesse puru Giorgiu, stesseme appostu	Bagnoli Irpino	Avellino,Avellino,Campania	Irpino	
		Ce và pur Giorg' stam  a post.	Bari	Bari,Bari,Puglia	Apulo-barese	
		Anneret finzas Giogli...	Bitti	Bitti,Nuoro,Sardegna	Nuorese	
		P 'tess' scì pur' Giorg', sariemm' a post'	Calitri	Avellino,Avellino,Campania	Laziale meridionale	
		Si scésse pure Giorge, stessёme a postö	Carife	Avellino,Avellino,Campania	Irpino	
		Se scia puru lu Giorgiu, stavene ppostu.	Castrignano del Capo	Castrignano del Capo,Lecce,Puglia	Salentino meridionale	
		Si ci issi macari Giorgio, fussimu a ppostu.	Catania1	Catania,Catania,Sicilia	Area orientale non metafonetica	
		Su ci issi anche Giorgio, fussimu apposto.	Catania2	Catania,Catania,Sicilia	Area orientale non metafonetica	
		Si sinni issi macari Giorgiu fussimu a postu.	Catania3	Catania,Catania,Sicilia	Area orientale non metafonetica	
		Si ci issi macari Gioggiu, fussimu a postu.	Catania4	Catania,Catania,Sicilia	Area orientale non metafonetica	
		Se vae puru lu Giorgiu, stamu a postu.	Corigliano d'Otranto	Corigliano d'Otranto,Lecce,Puglia	Salentino meridionale	
		Si ci issi puru Giorgio, fussimo a posto!	Corleone	Corleone,Palermo,Sicilia	Occidentale	
		Si jissa puru Giorgio, fossimu a postu.	Cosenza	Cosenza,Cosenza,Calabria	Calabrese centrale	
		Putissa gghjri puru Giorgiu, fussimu a postu.	Crotone	Crotone,Crotone,Calabria	Calabrese centrale	
		Ci scia puru u Ngiorgi...	Gallipoli1	Gallipoli,Lecce,Puglia	Salentino meridionale	
		Ci scia puru u Giorgiu...	Gallipoli1	Gallipoli,Lecce,Puglia	Salentino meridionale	
		Si ni glisse pure Giorgio, fussimu a posto.	Laino Castello	Laino Castello,Cosenza,Calabria	Area arcaica lucano-calabrese	
		C’ scèv pur Giorg stèvn a post!	Locorotondo	Locorotondo,Bari,Puglia	Apulo-barese	
		Se jia puru Giorgio, erimo a posto.	Locri	Locri,Reggio di Calabria,Calabria	Calabrese meridionale	
		Se ce jèsse pure Giorgio, sarìmo a ppóstu.	Macerata	Macerata,Macerata,Marche	Maceratese	
		Se ce va pure Giorgio, simo a ppóstu.	Macerata	Macerata,Macerata,Marche	Maceratese	
		Si esse pure Giorgio, stessem a posto.	Marcianise	Marcianise,Caserta,Campania	Napoletano	
		Scesse pure Giorg, che cussi simə a postə	Melfi	Melfi,Potenza,Basilicata	Lucano nord-occidentale	
		Si nn'arrìa puru Giorgiu, sarìumu a postu.	Messina1	Messina,Messina,Sicilia	Messinese	
		Si annassi puru Giorgiu, sarìumu a postu.	Messina2	Messina,Messina,Sicilia	Messinese	
		Annirrìa puru Gioggiu, sarìamu a postu.	Messina3	Messina,Messina,Sicilia	Messinese	
		Scess' pur' Giorg' e sim' appost'	Molfetta2	Molfetta,Bari,Puglia	Apulo-barese	
		S' n' scess' pur Giorg' e stimm' appost'	Molfetta3	Molfetta,Bari,Puglia	Apulo-barese	
		Scess' pur' Giorg' ama sta bbun'	Molfetta4	Molfetta,Bari,Puglia	Apulo-barese	
		Ci ve pur' Giorg', simm' appost'	Molfetta5	Molfetta,Bari,Puglia	Apulo-barese	
		Ci ve pur' Giorg', simm' appost'	Molfetta6	Molfetta,Bari,Puglia	Apulo-barese	
		Ci avessa sci pur' Giorgio, staremm' a ppost'	Molfetta7	Molfetta,Bari,Puglia	Apulo-barese	
		Si jaria puru Giorgiu, sariamu appostu.	Monasterace1	Monasterace,Reggio di Calabria,Calabria	Calabrese meridionale	
		Si jarria puru Giorgi sarriamu a ppostu.	Monasterace2	Monasterace,Reggio di Calabria,Calabria	Calabrese meridionale	
		Partess puru Giorgiu, stissim a ppostu	Montecalvo Irpino	Avellino,Avellino,Campania	Irpino	
		Si vai puro Giorgio sim' apposto	Montella	Montella,Avellino,Campania	Irpino	
		Cu vaie puru u Giorgi, stivine a postu.	Ortelle	Ortelle,Lecce,Puglia	Salentino meridionale	
		Si andaìada puru Giosi fumis a postu	Ossi	Ossi,Sassari,Sardegna	Logudorese settentrionale	
		Ce gisse anche Giorgio, saremmo a posto.	Paciano	Paciano,Perugia,Umbria	Settentrionale	
		Si ci issi puru Giorgi, fussimu appostu.	Palermo2	Palermo,Palermo,Sicilia	Occidentale	
		Si ci issi puru Giorgi, fussimu appostu	Palermo6	Palermo,Palermo,Sicilia	Occidentale	
		Si ci issi puru Giorgio fussimo apposto	Palermo7	Palermo,Palermo,Sicilia	Occidentale	
		Si ci issi puru Giorgio fussimu apposto	Palermo8	Palermo,Palermo,Sicilia	Occidentale	
		Ci issi puru Giorgio, fussimo a posto	Palermo9	Palermo,Palermo,Sicilia	Occidentale	
		Si ci yera puru Giorgiu ferimu a postu.	Papasidero	Papasidero,Cosenza,Calabria	Area arcaica lucano-calabrese	
		Se cə jassə purə GGiurgə, ʃtemə appuʃtə	Pennapiedimonte	Pennapiedimonte,Chieti,Abruzzo	Abruzzese orientale adriatico	
		Si diad’andare finzas Zorzi diammus essere a caddu	Posada	Posada,Nuoro,Sardegna	Nuorese	
		Se lu Giorgiu ae, putiame essere a posto.	San Cesario di Lecce	San Cesario di Lecce,Lecce,Puglia	Salentino centrale	
		Jesse pure Giorge, stessime apposte.	San Marco in Lamis	San Marco in Lamis,Foggia,Puglia	Garganico	
		Se cə nə jassə purə Ggiorgə fussəmə a ppostə	San Martino in Pensilis	San Martino in Pensilis,Campobasso,Molise	Meridionale Intermedio Molisano	
		Pinzàvine ca èra tardi	Scampitella	Avellino,Avellino,Campania	Irpino	
		Si scésse pure Ggiòrge, stéssime a ppòste	Scampitella	Avellino,Avellino,Campania	Irpino	
		Issi anche Giorgio, fussimu apposto.	Sciacca	Sciacca,Agrigento,Sicilia	Occidentale	
		Ah, si ccə jessa pur Giorgio fossim a ppostu.	Terravecchia	Terravecchia,Cosenza,Calabria	Calabrese settentrionale	
		Ci scia puru lu Giorgiu, stiamo appostu.	Trepuzzi	Trepuzzi,Lecce,Puglia	Salentino centrale	
		Scess' pur Giorg, saremm a post.	Trevico	Trevico,Avellino,Campania	Irpino	
		Suddu ci issi macari Giorgio, fussimu a puostu.	Troina1	Troina,Enna,Sicilia	Area metafonetica centrale	
		Su ci issi macari Giorgio, fussimu a puostu.	Troina10	Troina,Enna,Sicilia	Area metafonetica centrale	
		Su ci issi Giorgio, fussimu a puostu.	Troina2	Troina,Enna,Sicilia	Area metafonetica centrale	
		Su si inn'iu macari Giorgio, simu a puostu.	Troina3	Troina,Enna,Sicilia	Area metafonetica centrale	
		Su ci issi macari Giorgio, fussimu a puostu.	Troina4	Troina,Enna,Sicilia	Area metafonetica centrale	
		Si s'innissi Giorgio, fussimu a puostu.	Troina5	Troina,Enna,Sicilia	Area metafonetica centrale	
		Su ci issi macari Giorgio, fussimu a puostu.	Troina6	Troina,Enna,Sicilia	Area metafonetica centrale	
		Vinissi macari Giorgio, fussimu a puostu.	Troina7	Troina,Enna,Sicilia	Area metafonetica centrale	
		Ci issi macari Giorgio, fussimu a puostu.	Troina8	Troina,Enna,Sicilia	Area metafonetica centrale	
		Suddu ci issi macari Giorgio, fussimu a puostu.	Troina9	Troina,Enna,Sicilia	Area metafonetica centrale	
		S’ vaje pour’ Giorgio stacemm’ a post’.	Venosa	Venosa,Potenza,Basilicata	Lucano nord-occidentale	
		Se vaie u Giorgiu, stamu a posto.	Vitigliano	Santa Cesarea Terme,Lecce,Puglia	Salentino meridionale	
						
541.0	47.0	Credevamo che fosse tardi				 | avv temp | bridge verb | cong imperf | credere | essere | fless 3 | fless 4 | indic imperf | pro | trans | 
		Si crirévunu ca eva tardi	Ariano Irpino	Ariano Irpino,Avellino,Campania	Irpino	
		Crerievene ca er tardu	Bagnoli Irpino	Avellino,Avellino,Campania	Irpino	
		Me credev che jeva cchiù ttard.	Bari	Bari,Bari,Puglia	Apulo-barese	
		Crediamusu chi esserete tardu	Bitti	Bitti,Nuoro,Sardegna	Nuorese	
		S'ch 'rrienn' ca era tard'	Calitri	Avellino,Avellino,Campania	Laziale meridionale	
		Se crёrrévёne ca erä tarde	Carife	Avellino,Avellino,Campania	Irpino	
		Ne cradivane ca era tardu.	Castrignano del Capo	Castrignano del Capo,Lecce,Puglia	Salentino meridionale	
		Nni pareva ca era taddu.	Catania1	Catania,Catania,Sicilia	Area orientale non metafonetica	
		Cridiumu cà era tardu.	Catania2	Catania,Catania,Sicilia	Area orientale non metafonetica	
		Crireumu ca s'ava fattu troppu tardu.	Catania3	Catania,Catania,Sicilia	Area orientale non metafonetica	
		Ni pareva taddu.	Catania4	Catania,Catania,Sicilia	Area orientale non metafonetica	
		Cridame ca era tardi.	Corigliano d'Otranto	Corigliano d'Otranto,Lecce,Puglia	Salentino meridionale	
		Criiamo ca era tardu.	Corleone	Corleone,Palermo,Sicilia	Occidentale	
		Credìamu c’era tardu.	Cosenza	Cosenza,Cosenza,Calabria	Calabrese centrale	
		Pinzavumu c’era tardi.	Crotone	Crotone,Crotone,Calabria	Calabrese centrale	
		Critiane ca era tardu.	Gallipoli1	Gallipoli,Lecce,Puglia	Salentino meridionale	
		Ni cridiamu ca iera tarda.	Laino Castello	Laino Castello,Cosenza,Calabria	Area arcaica lucano-calabrese	
		N pnzèvn ca ier tard.	Locorotondo	Locorotondo,Bari,Puglia	Apulo-barese	
		Cridivumu ca era tardu.	Locri	Locri,Reggio di Calabria,Calabria	Calabrese meridionale	
		Ce paria ch’adèra tardi.	Macerata	Macerata,Macerata,Marche	Maceratese	
		Ce crererem che foss tardi.	Marcianise	Marcianise,Caserta,Campania	Napoletano	
		Crərimmə ca fossə tardə	Melfi	Melfi,Potenza,Basilicata	Lucano nord-occidentale	
		Cridìumu chi era taddu.	Messina1	Messina,Messina,Sicilia	Messinese	
		Cridìumu chi era taddu.	Messina2	Messina,Messina,Sicilia	Messinese	
		Nni paria chi era taddu.	Messina3	Messina,Messina,Sicilia	Messinese	
		P'nzemm' ca er' tard'	Molfetta1	Molfetta,Bari,Puglia	Apulo-barese	
		Penzemm' che er' tard'	Molfetta2	Molfetta,Bari,Puglia	Apulo-barese	
		Cr'demm' che foss' tard'	Molfetta3	Molfetta,Bari,Puglia	Apulo-barese	
		P'nzemm' ca foss' tard'	Molfetta4	Molfetta,Bari,Puglia	Apulo-barese	
		Cr'demm' che foss' tard'	Molfetta5	Molfetta,Bari,Puglia	Apulo-barese	
		P'nzemm' ca foss' tard'	Molfetta6	Molfetta,Bari,Puglia	Apulo-barese	
		P'nzemm' ca er' tard'	Molfetta7	Molfetta,Bari,Puglia	Apulo-barese	
		Cridiamu ca era tardi.	Monasterace1	Monasterace,Reggio di Calabria,Calabria	Calabrese meridionale	
		Mi paria ca era tardi.	Monasterace2	Monasterace,Reggio di Calabria,Calabria	Calabrese meridionale	
		Si cridèvinu ch'era tardu	Montecalvo Irpino	Avellino,Avellino,Campania	Irpino	
		Crirìano ca era già tardo	Montella	Montella,Avellino,Campania	Irpino	
		Pinzavine ca era tardu.	Ortelle	Ortelle,Lecce,Puglia	Salentino meridionale	
		Creìmis chi fu' tardu	Ossi	Ossi,Sassari,Sardegna	Logudorese settentrionale	
		Credemme che fusse tardi.	Paciano	Paciano,Perugia,Umbria	Settentrionale	
		Ci paria che fussi tardi.	Palermo2	Palermo,Palermo,Sicilia	Occidentale	
		Ci parìa che fussi tardi	Palermo6	Palermo,Palermo,Sicilia	Occidentale	
		Crittimu chi fussi tardi	Palermo7	Palermo,Palermo,Sicilia	Occidentale	
		Cririevamu ch’era tardu	Palermo8	Palermo,Palermo,Sicilia	Occidentale	
		Pinsavamu che era tardu	Palermo9	Palermo,Palermo,Sicilia	Occidentale	
		Pinsammu ka yera tardu.	Papasidero	Papasidero,Cosenza,Calabria	Area arcaica lucano-calabrese	
		Ja credavomə ca erə tordə	Pennapiedimonte	Pennapiedimonte,Chieti,Abruzzo	Abruzzese orientale adriatico	
		Creiamus chi fit tardu	Posada	Posada,Nuoro,Sardegna	Nuorese	
		Pensamme ca era tardi.	San Cesario di Lecce	San Cesario di Lecce,Lecce,Puglia	Salentino centrale	
		Credevame che jeva tarde.	San Marco in Lamis	San Marco in Lamis,Foggia,Puglia	Garganico	
		Penzavənə ca jevə tardə	San Martino in Pensilis	San Martino in Pensilis,Campobasso,Molise	Meridionale Intermedio Molisano	
		Pinzàvine ca èra tardi	Scampitella	Avellino,Avellino,Campania	Irpino	
		Cridriamo chi fussi tarddu.	Sciacca	Sciacca,Agrigento,Sicilia	Occidentale	
		Amu penzatu ch’eva tardə.	Terravecchia	Terravecchia,Cosenza,Calabria	Calabrese settentrionale	
		'Nni crediamo ca era tardu.	Trepuzzi	Trepuzzi,Lecce,Puglia	Salentino centrale	
		N' pinzamm ca facemm tard.	Trevico	Trevico,Avellino,Campania	Irpino	
		Cridimmu chi era taddu.	Troina1	Troina,Enna,Sicilia	Area metafonetica centrale	
		Credevamo chi fussi taddu.	Troina10	Troina,Enna,Sicilia	Area metafonetica centrale	
		Cridimmu chi era taddu.	Troina2	Troina,Enna,Sicilia	Area metafonetica centrale	
		Ni cridia chi era taddu.	Troina3	Troina,Enna,Sicilia	Area metafonetica centrale	
		Pinsammu chi era taddu.	Troina4	Troina,Enna,Sicilia	Area metafonetica centrale	
		Pinsammu chi fussi taddu.	Troina5	Troina,Enna,Sicilia	Area metafonetica centrale	
		Cridimmu chi era taddu.	Troina6	Troina,Enna,Sicilia	Area metafonetica centrale	
		Pinsammu chi fussi taddu.	Troina7	Troina,Enna,Sicilia	Area metafonetica centrale	
		Cridimmu ca era taddu.	Troina8	Troina,Enna,Sicilia	Area metafonetica centrale	
		Ni paria chi era taddu.	Troina9	Troina,Enna,Sicilia	Area metafonetica centrale	
		Parje tard’.	Venosa	Venosa,Potenza,Basilicata	Lucano nord-occidentale	
		Ne pinsavie ca era tardu.	Vitigliano	Santa Cesarea Terme,Lecce,Puglia	Salentino meridionale	
						
541.0	52.0	Prima che entri qualcuno, chiudiamo la porta				 | cong pres | cong princ | fless 3 | fless 4 | inacc | ogg def | ogg dir | ogg femm | ogg sing | pro | QP sogg | sogg postv | trans | 
		Prima ca trasi coccherunu, chiurìmu la porta	Ariano Irpino	Ariano Irpino,Avellino,Campania	Irpino	
		Prima ca trase quaccherunu, chiurimu la porta	Bagnoli Irpino	Avellino,Avellino,Campania	Irpino	
		Acchiedim la  port', angor ven' qualchedun.	Bari	Bari,Bari,Puglia	Apulo-barese	
		Prima chi intreret carcune tancammus sa ianna	Bitti	Bitti,Nuoro,Sardegna	Nuorese	
		Prima chi tras ' quaccun', ch'rim' a porta	Calitri	Avellino,Avellino,Campania	Laziale meridionale	
		Prime ca trase quaccherùne, chiurìmme la porte	Carife	Avellino,Avellino,Campania	Irpino	
		Prima cu trase ciuveddhi, chiudimu la porta.	Castrignano del Capo	Castrignano del Capo,Lecce,Puglia	Salentino meridionale	
		Prima ca occarunu trasi, chiuremu a potta.	Catania1	Catania,Catania,Sicilia	Area orientale non metafonetica	
		Chiremu à porta, prima cà trasi quarcunu.	Catania2	Catania,Catania,Sicilia	Area orientale non metafonetica	
		Chiuri a potta prima ca trasi quoccarunu.	Catania3	Catania,Catania,Sicilia	Area orientale non metafonetica	
		Chiuremu a potta prima ca trasi occarunu.	Catania4	Catania,Catania,Sicilia	Area orientale non metafonetica	
		Prima cu trase qualche d'unu, chiudimu la porta.	Corigliano d'Otranto	Corigliano d'Otranto,Lecce,Puglia	Salentino meridionale	
		Prima ca trasi qualchiduno, chiudemo a porta.	Corleone	Corleone,Palermo,Sicilia	Occidentale	
		Prima ca trase ‘ngunu, chiudimu ‘a porta.	Cosenza	Cosenza,Cosenza,Calabria	Calabrese centrale	
		′Mprima ca drasa ancunu, chjudimu ′a porta.	Crotone	Crotone,Crotone,Calabria	Calabrese centrale	
		Prima cu trase faccincunu chutimu a porta.	Gallipoli1	Gallipoli,Lecce,Puglia	Salentino meridionale	
		Prima che trase anguno, chiudemo à porta.	Laino Castello	Laino Castello,Cosenza,Calabria	Area arcaica lucano-calabrese	
		Prim ca trés nguiun ammarr(e) a port!	Locorotondo	Locorotondo,Bari,Puglia	Apulo-barese	
		Prima u trasi acchidunu, chiudimu a porta.	Locri	Locri,Reggio di Calabria,Calabria	Calabrese meridionale	
		Chiudímo la pòrta, prima che venèsse quarghidú / prima che vène quarghidú.	Macerata	Macerata,Macerata,Marche	Maceratese	
		Prima che trase quarcuno chiurimmo a porta.	Marcianise	Marcianise,Caserta,Campania	Napoletano	
		Primə ca trasə qualcunə, chiurəmmə la portə	Melfi	Melfi,Potenza,Basilicata	Lucano nord-occidentale	
		Prima chi trasi coccadunu, chiudemu a potta.	Messina1	Messina,Messina,Sicilia	Messinese	
		Prima mi trasi coccadunu, chiudemu a potta.	Messina1	Messina,Messina,Sicilia	Messinese	
		Prima chi trasi caccudunu, gghiudemu 'a potta.	Messina2	Messina,Messina,Sicilia	Messinese	
		Prima mi trasi caccudunu, gghiudemu 'a potta.	Messina2	Messina,Messina,Sicilia	Messinese	
		Prima mi trasi quacchidunu, gghiudemu a potta.	Messina3	Messina,Messina,Sicilia	Messinese	
		Prim' ca tras' quachedaun', acchjdim' la powrt'	Molfetta1	Molfetta,Bari,Puglia	Apulo-barese	
		Prim' ca tras' qualchedaun', acchjdim' la port'	Molfetta2	Molfetta,Bari,Puglia	Apulo-barese	
		Prim' ca tras' qualchedaun', acchjdim' la port'	Molfetta3	Molfetta,Bari,Puglia	Apulo-barese	
		Prim' ca tras' qualchedaun', acchjdim' la port'	Molfetta4	Molfetta,Bari,Puglia	Apulo-barese	
		Prim' ca tras' qualchedaun', acchjdim' la port'	Molfetta5	Molfetta,Bari,Puglia	Apulo-barese	
		Prim' ca tras' qualchedaun', acchjdim' la port'	Molfetta6	Molfetta,Bari,Puglia	Apulo-barese	
		Prim' ca tras' qualchedaun', acchjdim' la port'	Molfetta7	Molfetta,Bari,Puglia	Apulo-barese	
		Prima co trasa ncunu chiudimu a porta.	Monasterace1	Monasterace,Reggio di Calabria,Calabria	Calabrese meridionale	
		Prima co trasa ncunu chiudimu a porta.	Monasterace2	Monasterace,Reggio di Calabria,Calabria	Calabrese meridionale	
		Primu ca trase cocchidunu, chiudimu la porta	Montecalvo Irpino	Avellino,Avellino,Campania	Irpino	
		Prima ca cocchirùno trase nserra la porta	Montella	Montella,Avellino,Campania	Irpino	
		Prima cu trase quarcunu, chiudimu a porta.	Ortelle	Ortelle,Lecce,Puglia	Salentino meridionale	
		Innànti chi ìntrede calcùnu, tanàmus sa janna	Ossi	Ossi,Sassari,Sardegna	Logudorese settentrionale	
		Prima che entra qualcuno, chiudemo la porta	Paciano	Paciano,Perugia,Umbria	Settentrionale	
		Chiuiemu a puorta prima ca trasi qualcuno.	Palermo2	Palermo,Palermo,Sicilia	Occidentale	
		Chiuiemu a puorta prima ca trasi qualcuno	Palermo6	Palermo,Palermo,Sicilia	Occidentale	
		Prima ca trasi qualcunu chiuiemu a puorta	Palermo7	Palermo,Palermo,Sicilia	Occidentale	
		Prima ca trasi qualcunu chiuiemu a puorta	Palermo8	Palermo,Palermo,Sicilia	Occidentale	
		Prima ca trasi quallchedunu chiuiemu sta puorta	Palermo9	Palermo,Palermo,Sicilia	Occidentale	
		Chiurimu a porta, prima ki trasiri angunu.	Papasidero	Papasidero,Cosenza,Calabria	Area arcaica lucano-calabrese	
		Chjudaimə la purtə, primə che andrə cacchədiunə	Pennapiedimonte	Pennapiedimonte,Chieti,Abruzzo	Abruzzese orientale adriatico	
		Prima chi b’intred zente serramus sa janna	Posada	Posada,Nuoro,Sardegna	Nuorese	
		Prima ca trase quacchetunu, chiudiamo la porta.	San Cesario di Lecce	San Cesario di Lecce,Lecce,Puglia	Salentino centrale	
		Prima che trasce cacchedune, chiudime la porta.	San Marco in Lamis	San Marco in Lamis,Foggia,Puglia	Garganico	
		Prima che trase accunarùne, čhiurìme la pòrta	Scampitella	Avellino,Avellino,Campania	Irpino	
		Prima che entri qualcunu, chiuremu a porta.	Sciacca	Sciacca,Agrigento,Sicilia	Occidentale	
		Prima ca trasa ncunu cjiumt a port.	Terravecchia	Terravecchia,Cosenza,Calabria	Calabrese settentrionale	
		Prima cu 'ttrase quarchedunu, chiudimi la porta.	Trepuzzi	Trepuzzi,Lecce,Puglia	Salentino centrale	
		Prima ca tras qualcun, chiurimm la porta.	Trevico	Trevico,Avellino,Campania	Irpino	
		Prima chi s'appresenta quaccadunu, chiudimu a porta.	Troina1	Troina,Enna,Sicilia	Area metafonetica centrale	
		Prima chi trasi quaccudunu, chiudimu sa porta.	Troina10	Troina,Enna,Sicilia	Area metafonetica centrale	
		Prima chi trasi quaccadunu, chiudimu a porta.	Troina2	Troina,Enna,Sicilia	Area metafonetica centrale	
		Prima chi vieni quaccadunu, chiudimula a porta.	Troina3	Troina,Enna,Sicilia	Area metafonetica centrale	
		Prima chi trasi quaccadunu, chiudi a porta.	Troina4	Troina,Enna,Sicilia	Area metafonetica centrale	
		Prima chi trasi quaccadunu, chiudi sta porta.	Troina5	Troina,Enna,Sicilia	Area metafonetica centrale	
		Prima chi quaccadunu trasi, chiudimula sa porta.	Troina6	Troina,Enna,Sicilia	Area metafonetica centrale	
		Prima chi trasi quaccadunu, chiudimu a porta.	Troina7	Troina,Enna,Sicilia	Area metafonetica centrale	
		Prima ca trasi quaccunu, chiudimu a porta.	Troina8	Troina,Enna,Sicilia	Area metafonetica centrale	
		Prima chi trasi quaccadunu, chiudimu a porta.	Troina9	Troina,Enna,Sicilia	Area metafonetica centrale	
		Achiour’ la port’ preim’ ca tr’s qualcheroun’.	Venosa	Venosa,Potenza,Basilicata	Lucano nord-occidentale	
		Prima cu trase ciuveggi, chiudimu a porta. ce ai vistu ieri era ziuma.	Vitigliano	Santa Cesarea Terme,Lecce,Puglia	Salentino meridionale	
						
541.0	55.0	In qualsiasi modo il direttore voglia risolvere questo problema, noi ci trasferiremo.				 | clit 4 | clit rifless | cong pres | dimostr | fless 3 | fless 4 | inacc | indic fut sempl | inf sempl | ogg def | ogg dir | ogg masch | ogg sing | PP | PP sing | sogg def | sogg masch | sogg nom | sogg plur | sogg prev | sogg prev | sogg pron | sogg sing | subord | trans | volere | 
		In qualunque modu lu direttoru voli risolvi stu problema, nui ci trasfirimu	Ariano Irpino	Ariano Irpino,Avellino,Campania	Irpino	
		Cummu vole vole sbruglià sta matassa lu direttore, nui ngi spustamo a ra quà	Bagnoli Irpino	Avellino,Avellino,Campania	Irpino	
		Nù nge ne sciam', ciò che decid' e decid' u  direttor.	Bari	Bari,Bari,Puglia	Apulo-barese	
		In calesisiat manera su direttore chegliata risolvere custu anneu, noisi nos amusu a trasferire	Bitti	Bitti,Nuoro,Sardegna	Nuorese	
		Cum' val' fa fac' u direttor', nuj n' sciam'	Calitri	Avellino,Avellino,Campania	Laziale meridionale	
		Cume vole fa face lu direttore pe rёsolve stu prubbleme, nuje ce ne sciamme a n'ata parte	Carife	Avellino,Avellino,Campania	Irpino	
		In qualsiasi maniera lu Direttore vole rrisolve stu problema, nui ne trasferimu.	Castrignano del Capo	Castrignano del Capo,Lecce,Puglia	Salentino meridionale	
		Penzu ca rumani n'o pottu.	Catania1	Catania,Catania,Sicilia	Area orientale non metafonetica	
		In qualunque modu ù diritturi ci piaci d'arrisulviri ù problema, nutri ni trasfiremu.	Catania2	Catania,Catania,Sicilia	Area orientale non metafonetica	
		Zoccu voli fari u diritturi pi abbissari i cosi nutri ni trasfiremu u stissu.	Catania3	Catania,Catania,Sicilia	Area orientale non metafonetica	
		Comu sburugghia - sburugghia u diritturi sta facenna, nuattri ni ni stunnamu.	Catania4	Catania,Catania,Sicilia	Area orientale non metafonetica	
		In qualsiasi modu lu direttore vole risolva lu problema, ci trasferimu.	Corigliano d'Otranto	Corigliano d'Otranto,Lecce,Puglia	Salentino meridionale	
		Como vole risolviri u diretture stù problema, natri ni trasiremo.	Corleone	Corleone,Palermo,Sicilia	Occidentale	
		‘Ntra qualunque modu u direttore vulissa cunzà ‘a cosa, nua ni nni jamu u stess.	Cosenza	Cosenza,Cosenza,Calabria	Calabrese centrale	
		Comu ′u direttoru vo’ risorviri ′stu problema, nuji ni drasfirimu.	Crotone	Crotone,Crotone,Calabria	Calabrese centrale	
		Comu ete ete ca u direttore ole cu risolve u problema, nui nde trasferimu.	Gallipoli1	Gallipoli,Lecce,Puglia	Salentino meridionale	
		A qualunque modo u direttore vo risolve stu problema, noi ninniamu.	Laino Castello	Laino Castello,Cosenza,Calabria	Area arcaica lucano-calabrese	
		Cum vuol u rsolv u direttor stu priblem, neggu(e) n’ scém.	Locorotondo	Locorotondo,Bari,Puglia	Apulo-barese	
		Se u direttori voli affrontari stu problema, noi ndi ribeiamu.	Locri	Locri,Reggio di Calabria,Calabria	Calabrese meridionale	
		Quarzíasi cósa che vor(r)á ffa’ lu direttore, nuáddri ce jjímo via lo stésso.	Macerata	Macerata,Macerata,Marche	Maceratese	
		In qualsiasi modo o direttore vo risolver chistu problema, nui ce ne iammo.	Marcianise	Marcianise,Caserta,Campania	Napoletano	
		'Nta qualsiasi modu u diritturi voli risòbbiri stu prubblema, nui ni trasfiremu.	Messina1	Messina,Messina,Sicilia	Messinese	
		Ntà quassiasi modu u diritturi voli risobbiri stù pobblema, nui nnì trasfiremu.	Messina2	Messina,Messina,Sicilia	Messinese	
		'Nta ogni modu u diritturi voli risovviri stu prubblema, nui nni trasfiremu.	Messina3	Messina,Messina,Sicilia	Messinese	
		Ind' a qualsias' mener' u direttowr' vol' r'solv'cuss' probblem', new n'scimm'	Molfetta1	Molfetta,Bari,Puglia	Apulo-barese	
		Ind' a qualsiasi mener' u direttor' vol' r'solv' stu probblem', new ne trasferimm'	Molfetta2	Molfetta,Bari,Puglia	Apulo-barese	
		In qualung' mod' u direttor' vol' r'solv' cuss' probblem', new n' trasferimm'	Molfetta3	Molfetta,Bari,Puglia	Apulo-barese	
		Ind' a qualungw' mener' u d'rettowr' vol' r'sulv' stu probblem', new n' scimm' da do	Molfetta4	Molfetta,Bari,Puglia	Apulo-barese	
		In qualsiasi mener' u direttowr' vol' r'solv' stu probblem', new n' trasferimm'	Molfetta5	Molfetta,Bari,Puglia	Apulo-barese	
		In qualsiasi mod' u direttor' vol' r'solv' cuss' probblem', new n' trasferimm'	Molfetta6	Molfetta,Bari,Puglia	Apulo-barese	
		Ind' a qualsiasi mener' u direttor' vol' r'solv' stu probblem', new ne ma trasferi	Molfetta7	Molfetta,Bari,Puglia	Apulo-barese	
		Nta qualsiasi manera u direttori vola u risolva stu problema, nui mi trasferimu.	Monasterace1	Monasterace,Reggio di Calabria,Calabria	Calabrese meridionale	
		Comu vola u direttori u cconza a situazioni nui mi trasperimu.	Monasterace2	Monasterace,Reggio di Calabria,Calabria	Calabrese meridionale	
		Tuttu queddru ca vole fa lu dirittore p'accunzà li cose, ma nuji cagnamu postu	Montecalvo Irpino	Avellino,Avellino,Campania	Irpino	
		Come cionga lo direttore oIe fa nui nge n'amma sulo ì'	Montella	Montella,Avellino,Campania	Irpino	
		In qualsiasi modu lu direttore ole cu risolve u problema, niu ne trasferimu.	Ortelle	Ortelle,Lecce,Puglia	Salentino meridionale	
		In cale si sia manera su direttore cheffada risolvere custu problema, noi no' c'amus a cambiare	Ossi	Ossi,Sassari,Sardegna	Logudorese settentrionale	
		Comunque ‘l direttore risolve ‘sto problema noi ce trasferiremo.	Paciano	Paciano,Perugia,Umbria	Settentrionale	
		Nzuoccu voli fari u diretturi pi stu problema nuatri ninniamu ri ca.	Palermo2	Palermo,Palermo,Sicilia	Occidentale	
		. Nzuoccu voli fari u diretturi pi stu problema nuatri ninniamu ri ca.	Palermo6	Palermo,Palermo,Sicilia	Occidentale	
		In qualunque maniera u diritturi vuoli spirugghiari sta questione, noialtri ninniamu	Palermo7	Palermo,Palermo,Sicilia	Occidentale	
		Qualunque cuosa piensa u diritturi nuatri ninniamu	Palermo9	Palermo,Palermo,Sicilia	Occidentale	
		‘Nda qualunca manera u direttore vù risolvi u problema, nui ni trasferimu.	Papasidero	Papasidero,Cosenza,Calabria	Area arcaica lucano-calabrese	
